Name,Symbol,Fund Type,MasterDATA
SPDR S&P Russia ETF,RBL,Global Equity ETF,_
SPDR S&P Semiconductor ETF,XSD,US Equity ETF,1
SPDR S&P Software & Services ETF,XSW,US Equity ETF,_
SPDR S&P Telecom ETF,XTL,US Equity ETF,_
SPDR S&P Transportation ETF,XTN,US Equity ETF,_
SPDR S&P VRDO Municipal Bond ETF,VRD,Fixed Income ETF,_
SPDR S&P World ex-US ETF,GWL,Global Equity ETF,_
SPDR Technology Select Sector Fund ETF,XLK,US Equity ETF,2
SPDR Utilities Select Sector Fund ETF,XLU,US Equity ETF,2
SPDR Wells Fargo Preferred Stock ETF,PSK,Fixed Income ETF - Equity,_
Teucrium CANE Fund ETF,CANE,Commodity Based ETF,_
Teucrium Corn Fund ETF,CORN,Commodity Based ETF,_
Teucrium Crude Oil Fund ETF,CRUD,Commodity Based ETF,_
Teucrium Natural Gas Fund ETF,NAGS,Commodity Based ETF,_
Teucrium Soybean Fund ETF,SOYB,Commodity Based ETF,_
Teucrium Wheat Fund ETF,WEAT,Commodity Based ETF,_
United States 12 Month Natural Gas Fund LP ETF,UNL,Commodity Based ETF,_
United States 12 Month Oil ETF,USL,Commodity Based ETF,_
United States Brent Oil Fund LP ETF,BNO,Commodity Based ETF,_
United States Commodity Index Fund ETF,USCI,Commodity Based ETF,__
United States Copper ETF,CPER,Commodity Based ETF,_
United States Gasoline Fund LP ETF,UGA,Commodity Based ETF,_
United States Heating Oil Fund LP ETF,UHN,Commodity Based ETF,_
United States Natural Gas Fund LP ETF,UNG,Commodity Based ETF,_
United States Oil Fund ETF,USO,Commodity Based ETF,_
United States Short Oil Fund LP ETF,DNO,Commodity Based ETF,_
Vanguard Consumer Discretion ETF - DNQ ETF,VCR,US Equity ETF,_
Vanguard Consumer Staples ETF - DNQ ETF,VDC,US Equity ETF,_
Vanguard Div Appreciation ETF - DNQ ETF,VIG,US Equity ETF,_
Vanguard Emerging Markets ETF,VWO,Global Equity ETF,_
Vanguard Energy ETF,VDE,US Equity ETF,_
Vanguard Europe Pacific ETF,VEA,Global Equity ETF,_
Vanguard European ETF,VGK,Global Equity ETF,_
Vanguard Extended Duration Treasury ETF,EDV,Fixed Income ETF,_
Vanguard Extended Market ETF,VXF,US Equity ETF,_
Vanguard Financials ETF - DNQ ETF,VFH,US Equity ETF,_
Vanguard FTSE All World Ex US ETF,VEU,Global Equity ETF,_
Vanguard FTSE All-World ex-US Small-Cap ETF,VSS,Global Equity ETF,_
Vanguard Global ex-U.S. Real Estate ETF,VNQI,Global Equity ETF,_
Vanguard Growth ETF,VUG,US Equity ETF,_
Vanguard Health Care ETF - DNQ ETF,VHT,US Equity ETF,_
Vanguard High Dividend Yield ETF,VYM,US Equity ETF,_
Vanguard Industrials ETF - DNQ ETF,VIS,US Equity ETF,_
Vanguard Information Tech ETF - DNQ ETF,VGT,US Equity ETF,_
Vanguard Intermediate-Term Bond ETF,BIV,Fixed Income ETF,_
Vanguard Intermediate-Term Corporate Bond ETF,VCIT,Fixed Income ETF,_
Vanguard Intermediate-Term Government Bond ETF,VGIT,Fixed Income ETF,_
Vanguard Large-Cap ETF,VV,US Equity ETF,_
Vanguard Long-Term Bond ETF,BLV,Fixed Income ETF,_
Vanguard Long-Term Corporate Bond ETF,VCLT,Fixed Income ETF,_
Vanguard Long-Term Government Bond ETF,VGLT,Fixed Income ETF,_
Vanguard Materials ETF - DNQ ETF,VAW,US Equity ETF,_
Vanguard Mega Cap 300 ETF,MGC,US Equity ETF,_
Vanguard Mega Cap 300 Growth ETF,MGK,US Equity ETF,_
Vanguard Mega Cap 300 Value ETF,MGV,US Equity ETF,_
Vanguard Mid-Cap ETF,VO,US Equity ETF,_
Vanguard Mid-Cap Growth ETF,VOT,US Equity ETF,_
Vanguard Mid-Cap Value ETF,VOE,US Equity ETF,_
Vanguard Mortgage-Backed Securities ETF,VMBS,Fixed Income ETF,_
Vanguard Pacific ETF,VPL,Global Equity ETF,_
Vanguard REIT ETF - DNQ ETF,VNQ,US Equity ETF,_
Vanguard Russell 1000 ETF,VONE,US Equity ETF,_
Vanguard Russell 1000 Growth ETF,VONG,US Equity ETF,_
Vanguard Russell 1000 Value ETF,VONV,US Equity ETF,_
Vanguard Russell 2000 ETF,VTWO,US Equity ETF,_
Vanguard Russell 2000 Growth ETF,VTWG,US Equity ETF,_
Vanguard Russell 2000 Value ETF,VTWV,US Equity ETF,_
Vanguard Russell 3000 ETF,VTHR,US Equity ETF,_
Vanguard S&P 500 ETF,VOO,US Equity ETF,_
Vanguard S&P 500 Growth ETF,VOOG,US Equity ETF,_
Vanguard S&P 500 Value ETF,VOOV,US Equity ETF,_
Vanguard S&P Mid-Cap 400 ETF,IVOO,US Equity ETF,_
Vanguard S&P Mid-Cap 400 Growth ETF,IVOG,US Equity ETF,_
Vanguard S&P Mid-Cap 400 Value ETF,IVOV,US Equity ETF,_
Vanguard S&P Small-Cap 600 ETF,VIOO,US Equity ETF,_
Vanguard S&P Small-Cap 600 Growth ETF,VIOG,US Equity ETF,_
Vanguard S&P Small-Cap 600 Value ETF,VIOV,US Equity ETF,_
Vanguard Short-Term Bond ETF,BSV,Fixed Income ETF,_
Vanguard Short-Term Corporate Bond ETF,VCSH,Fixed Income ETF,_
Vanguard Short-Term Government Bond ETF,VGSH,Fixed Income ETF,_
Vanguard Small-Cap ETF,VB,US Equity ETF,_
Vanguard Small-Cap Growth ETF,VBK,US Equity ETF,_
Vanguard Small-Cap Value ETF,VBR,US Equity ETF,_
Vanguard Telecom ETF - DNQ ETF,VOX,US Equity ETF,_
Vanguard Total Bond Market ETF,BND,Fixed Income ETF,_
Vanguard Total International Stock ETF,VXUS,Global Equity ETF,_
Vanguard Total Stock Market ETF,VTI,US Equity ETF,_
Vanguard Total World Stock ETF,VT,Global Equity ETF,_
Vanguard Utilities ETF - DNQ ETF,VPU,US Equity ETF,_
Vanguard Value ETF,VTV,US Equity ETF,_
VelocityShares 2x Inverse Palladium ETN,IPAL,ETN,_
VelocityShares 2x Inverse Palladium ETN,IPAL,ETN,_
VelocityShares 2x Inverse Platinum ETN,IPLT,ETN,_
VelocityShares 2x Inverse Platinum ETN,IPLT,ETN,_
VelocityShares 2x Long Palladium ETN,LPAL,ETN,_
VelocityShares 2x Long Palladium ETN,LPAL,ETN,_
VelocityShares 2x Long Platinum ETN,LPLT,ETN,_
VelocityShares 2x Long Platinum ETN,LPLT,ETN,_
VelocityShares 3x Inverse Gold ETN,DGLD,ETN,_
VelocityShares 3x Inverse Gold ETN,DGLD,ETN,_
VelocityShares 3x Inverse Silver ETN,DSLV,ETN,_
VelocityShares 3x Inverse Silver ETN,DSLV,ETN,_
VelocityShares 3x Long Gold ETN,UGLD,ETN,_
VelocityShares 3x Long Gold ETN,UGLD,ETN,_
VelocityShares 3x Long Silver ETN,USLV,ETN,_
VelocityShares 3x Long Silver ETN,USLV,ETN,_
VelocityShares Daily 2X VIX Medium-Term ETN,TVIZ,ETN,_
VelocityShares Daily 2X VIX Short-Term ETN,TVIX,ETN,_
VelocityShares Daily Inverse VIX Medium-Term ETN,ZIV,ETN,_
VelocityShares Daily Inverse VIX Short-Term ETN,XIV,ETN,_
VelocityShares Daily Long VIX Medium-Term ETN,VIIZ,ETN,_
VelocityShares Daily Long VIX Short-Term ETN,VIIX,ETN,_
WisdomTree Asia Local Debt Fund ETF,ALD,Fixed Income ETF,_
WisdomTree Asia Pacific ex-Japan Fund ETF,AXJL,Global Equity ETF,_
WisdomTree Australia & New Zealand Debt Fund,AUNZ,Fixed Income ETF,_
WisdomTree Australia Dividend Fund ETF,AUSE,Global Equity ETF,_
WisdomTree Commodity Country Equity Fund ETF,CCXE,Global Equity ETF,_
WisdomTree DEFA Fund ETF,DWM,Global Equity ETF,_
WisdomTree DEFA High-Yielding Equity Fund ETF,DTH,Global Equity ETF,_
WisdomTree Dividend Top 100 Fund ETF,DTN,US Equity ETF,1
WisdomTree Dreyfus Brazilian Real Fund ETF,BZF,Commodity Based ETF,_
WisdomTree Dreyfus Chinese Yuan Fund ETF,CYB,Commodity Based ETF,_
WisdomTree Dreyfus Commodity Currency Fund ETF,CCX,Commodity Based ETF,_
WisdomTree Dreyfus Euro Fund ETF,EU,Commodity Based ETF,_
WisdomTree Dreyfus Indian Rupee Fund ETF,ICN,Commodity Based ETF,_
WisdomTree Dreyfus Japanese Yen Fund ETF,JYF,Commodity Based ETF,_
WisdomTree Dreyfus South African Rand Fund ETF,SZR,Commodity Based ETF,_
WisdomTree Earnings 500 Fund ETF,EPS,US Equity ETF,_
WisdomTree Emerging Market SmallCap Fund ETF,DGS,Global Equity ETF,_
WisdomTree Emerging Markets High-Yielding Fund ETF,DEM,Global Equity ETF,_
WisdomTree Emerging Markets Local Debt Fund ETF,ELD,Fixed Income ETF,_
WisdomTree Europe High-Yielding Equity Fund ETF,DEW,Global Equity ETF,_
WisdomTree Europe SmallCap Dividend Fund ETF,DFE,Global Equity ETF,_
WisdomTree Global ex-U.S. Growth Fund ETF,DNL,Global Equity ETF,_
WisdomTree Global ex-U.S. Real Estate Fund ETF,DRW,Global Equity ETF,_
WisdomTree Global ex-U.S. Utility Fund ETF,DBU,Global Equity ETF,_
WisdomTree Global Natural Resources Fund ETF,GNAT,Global Equity ETF,_
WisdomTree Global Real Return Fund ETF,RRF,Commodity Based ETF,_
WisdomTree High-Yielding Equity Fund ETF,DHS,US Equity ETF,2
WisdomTree India Earnings Fund ETF,EPI,Global Equity ETF,_
WisdomTree International Dividend Top 100 Fund ETF,DOO,Global Equity ETF,_
WisdomTree International Hedged Equity Fund ETF,HEDJ,Global Equity ETF,_
WisdomTree International LargeCap Dividend Fund ETF,DOL,Global Equity ETF,_
WisdomTree International MidCap Dividend Fund ETF,DIM,Global Equity ETF,_
WisdomTree International SmallCap Fund ETF,DLS,Global Equity ETF,_
WisdomTree Japan SmallCap Fund ETF,DFJ,Global Equity ETF,_
WisdomTree Japan Total Dividend Fund ETF,DXJ,Global Equity ETF,_
WisdomTree LargeCap Dividend Fund ETF,DLN,US Equity ETF,2
WisdomTree LargeCap Growth Fund ETF,ROI,US Equity ETF,_
WisdomTree Low P/E Fund ETF,EZY,US Equity ETF,_
WisdomTree Managed Futures Strategy Fund ETF,WDTI,Commodity Based ETF,_
WisdomTree MidCap Dividend Fund ETF,DON,US Equity ETF,1
WisdomTree MidCap Earnings Fund ETF,EZM,US Equity ETF,_
WisdomTree Middle East Dividend ETF,GULF,Global Equity ETF,_
WisdomTree SmallCap Earnings Fund ETF,EES,US Equity ETF,_
WisdomTree Total Dividend Fund ETF,DTD,US Equity ETF,_
WisdomTree Total Earnings Fund ETF,EXT,US Equity ETF,_
WisdomTree Trust SmallCap Dividend Fund ETF,DES,US Equity ETF,1
